{
  "$schema": "https://json-schema.org/draft/2020-12/schema",
  "$id": "https://example.com/brand-foundation.schema.json",
  "title": "BrandFoundation",
  "type": "object",
  "required": ["schemaVersion", "strictness", "attributes", "voice"],
  "properties": {
    "schemaVersion": { "const": "1" },
    "strictness": { "enum": ["strict", "flexible", "fresh"] },
    "attributes": {
      "type": "array",
      "minItems": 2,
      "maxItems": 6,
      "items": { "type": "string", "minLength": 2 }
    },
    "voice": {
      "type": "object",
      "required": ["tone", "personality"],
      "properties": {
        "tone": { "type": "string", "minLength": 2 },
        "personality": { "type": "string", "minLength": 10 },
        "doSay": { "type": "array", "items": { "type": "string" } },
        "dontSay": { "type": "array", "items": { "type": "string" } }
      },
      "additionalProperties": false
    },
    "antiReferences": { "type": "array", "items": { "type": "string" } },
    "inspirationReferences": {
      "type": "array",
      "items": {
        "type": "object",
        "required": ["name", "whatToLearn"],
        "properties": {
          "name": { "type": "string" },
          "whatToLearn": { "type": "string", "minLength": 10 }
        },
        "additionalProperties": false
      }
    },
    "technicalConstraints": {
      "type": "object",
      "properties": {
        "framework": { "type": "string" },
        "cssApproach": { "type": "string" },
        "browserTargets": { "type": "array", "items": { "type": "string" } },
        "deviceTargets": { "type": "array", "items": { "type": "string" } }
      },
      "additionalProperties": false
    }
  },
  "additionalProperties": false
}
